{
  "schema": "road-connector-fabric-v2",
  "version": "1.10.0",
  "checkedAt": "2026-09-09T06:16:06Z",
  "total": 65,
  "roles": {
    "control": [
      "adapter-plane", "appdeploy", "base44", "blackroad-ai-gateway", "cloudflare", "collaboration", "dataverse",
      "digitalocean-codex-infinity", "digitalocean-shellfish", "gitbook", "godaddy", "google-calendar",
      "hugging-face", "jotform", "microsoft-sharepoint", "netlify-network-atlas", "nvidia",
      "figma", "openai-platform", "plugin-registry", "posthog", "proxyman", "quicknode", "railway-api",
      "railway-cloud", "railway-core", "railway-orchestrator", "railway-roadie", "skill-registry",
      "stripe", "supabase", "tailscale-aperture", "tailscale-services", "vercel-context-bridge",
      "vercel-infra", "webhook-gateway", "workos", "zoho-crm", "zzzops"
    ],
    "decision": ["neura-relay"],
    "event": ["amplitude", "fireflies", "granola", "gsc-wizard", "meetgeek", "search", "semrush", "windsor-ai", "zoom"],
    "delivery": ["calendly", "docusign", "gmail", "outlook-email", "pandadoc", "resend", "retell-ai"],
    "reference-only": ["1password"],
    "discussion": ["airtable", "asana", "github", "google-drive", "linear", "notion", "slack", "webflow"]
  },
  "providerAliases": {
    "digitalocean-shellfish": "digitalocean-codex-infinity",
    "railway-cloud": "railway-api",
    "railway-core": "railway-api",
    "railway-orchestrator": "railway-api",
    "railway-roadie": "railway-api",
    "vercel-infra": "vercel-context-bridge"
  },
  "observations": {
    "appdeploy": {"state": "ready-empty", "detail": "Authenticated; no apps."},
    "base44": {"state": "ready", "detail": "Apps listed."},
    "cloudflare": {"state": "unverified", "detail": "Connector contract registered; no account-backed Cloudflare tool is surfaced in this session."},
    "digitalocean-codex-infinity": {"state": "ready", "detail": "Active account verified."},
    "figma": {"state": "ready", "detail": "Authenticated identity and starter team with a full seat verified."},
    "gitbook": {"state": "unverified", "detail": "Organization id required before a harmless read can run."},
    "godaddy": {"state": "limited", "detail": "Availability and suggestions only; no owned-domain or DNS tools."},
    "google-calendar": {"state": "ready", "detail": "Authenticated profile verified."},
    "hugging-face": {"state": "ready", "detail": "OAuth identity and read scopes verified."},
    "jotform": {"state": "ready-empty", "detail": "Authenticated; no teams."},
    "microsoft-sharepoint": {"state": "ready", "detail": "Authenticated profile verified."},
    "netlify-network-atlas": {"state": "ready", "detail": "Authenticated user verified."},
    "plugin-registry": {"state": "ready", "detail": "Plugin discovery and permission tools available."},
    "posthog": {"state": "ready", "detail": "BlackRoad OS organization verified."},
    "quicknode": {"state": "broken", "detail": "Valid endpoint-list request rejected as INVALID_ARGUMENT."},
    "railway-api": {"state": "ready", "detail": "Authenticated user verified."},
    "stripe": {"state": "broken", "detail": "OAuth token invalid_grant; reauthentication required."},
    "supabase": {"state": "ready", "detail": "Organization listing verified."},
    "vercel-context-bridge": {"state": "ready", "detail": "Team listing verified."},
    "workos": {"state": "limited", "detail": "OAuth identity works; no WorkOS dashboard account."},
    "zoho-crm": {"state": "ready", "detail": "Tool catalog responds."},
    "amplitude": {"state": "broken", "detail": "Context endpoint returns MCP internal error."},
    "fireflies": {"state": "broken", "detail": "Current-user endpoint returns 403 Forbidden."},
    "granola": {"state": "broken", "detail": "Account-info endpoint rejects valid empty input."},
    "gsc-wizard": {"state": "broken", "detail": "Account-info endpoint rejects valid empty input."},
    "meetgeek": {"state": "broken", "detail": "Meeting read fails because an authentication header is missing."},
    "search": {"state": "ready", "detail": "Native search surface available."},
    "semrush": {"state": "limited", "detail": "Authenticated; additional API units required."},
    "windsor-ai": {"state": "ready-empty", "detail": "Free account authenticated; zero sources connected."},
    "zoom": {"state": "ready-empty", "detail": "Recording read succeeds; no recordings in probe window."},
    "calendly": {"state": "ready", "detail": "Current user verified."},
    "docusign": {"state": "ready", "detail": "Current user and account verified."},
    "gmail": {"state": "ready", "detail": "Authenticated profile verified."},
    "outlook-email": {"state": "unverified", "detail": "Plugin connection confirmed; harmless account-backed mailbox read is not surfaced in this execution session."},
    "pandadoc": {"state": "ready", "detail": "Document listing verified."},
    "resend": {"state": "ready-empty", "detail": "Authenticated; no sending domains."},
    "retell-ai": {"state": "unverified", "detail": "Workspace selection is interactive and was not changed during audit."},
    "1password": {"state": "unavailable", "detail": "Local MCP tools are not surfaced in this cloud session."},
    "airtable": {"state": "ready", "detail": "MCP ping succeeded."},
    "asana": {"state": "ready", "detail": "Team listing verified."},
    "github": {"state": "ready", "detail": "Authenticated profile and repository access verified."},
    "google-drive": {"state": "ready", "detail": "Authenticated profile and file search verified."},
    "linear": {"state": "ready", "detail": "Blackboxprogramming workspace verified."},
    "notion": {"state": "ready", "detail": "Recent-page read verified."},
    "slack": {"state": "ready", "detail": "BlackRoad Inc. workspace and 24 joined channels verified."},
    "webflow": {"state": "ready", "detail": "BlackRoad site listing verified."}
  },
  "invariants": [
    "unknown-connectors-fail-restrictive",
    "external-communication-requires-explicit-user-approval",
    "control-and-decision-mutations-require-governance",
    "provider-mutations-require-exclusive-claim",
    "provider-success-requires-read-after-write-verification",
    "secret-values-never-enter-fabric"
  ]
}
